Country,Execution_Capacity_Score,Delivery_Track_Record,Infrastructure_Quality,Public_Investment_Deployment,Continuity_Risk,Anchoring_Sources,Evidence_Notes
Turkey,54,58,55,52,48,WEF GCI 2019 (4.5/7 infra); TI CPI 2024 (34/100); World Bank data,$100B infra spend in 15 years. Istanbul Airport (80M pax). 3 major bridges. Istanbul-Izmir highway. But quality concerns and CPI 34 = high corruption. Investment ~4% GDP. Strong delivery capacity but institutional quality declining rapidly.
UAE,82,85,88,78,72,WEF GCI 2019 (5.7/7 infra); TI CPI 2024 (68/100); World Bank LPI 2023,Dubai from desert to global hub in 30 years. Barakah nuclear 4 reactors in 12 years. Etihad Rail. Mobile internet #1 globally. WEF infra 23rd but misleading (city-states skew). CPI 68 = moderate-low corruption. Investment ~6% GDP. Execution speed rivaling China in concentrated areas.
United Kingdom,53,42,65,38,72,WEF GCI 2019 (5.1/7 infra); TI CPI 2024 (71/100); OECD data,"HS2 catastrophe (scaled back, massively over budget). Crossrail 4 years late, 2x over budget. Hinkley Point C nuclear delayed, 3x budget. WEF infra 20th. CPI 71 = moderate-low corruption. Investment only ~2% GDP — chronic underinvestment. Delivery capacity in crisis."
United States,50,38,68,35,62,WEF GCI 2019 (5.4/7 infra); TI CPI 2024 (65/100); OECD data; ASCE 2021 report card,"California HSR: 16+ years, $128B, zero passengers. Can't permit a transmission line. ASCE grade C-. But existing infra quality still decent (WEF ~12th). CPI 65 = moderate-low corruption. Investment only ~2.5% GDP. Permitting paralysis, NIMBY, regulatory capture. Massive gap between wealth and delivery."
Uruguay,47,42,48,38,65,WEF GCI 2019 (3.9/7 infra); TI CPI 2024 (62/100); World Bank data,"95%+ renewable electricity (wind + hydro). Best governance in Latin America. But infrastructure modest — limited rail, road quality mixed. CPI 62 = moderate-low corruption. Investment ~2.5% GDP. Strong institutions but limited scale and resources."
Venezuela,16,15,20,12,18,WEF GCI 2019 (2.0/7 infra est.); TI CPI 2024 (13/100); IMF data,"Infrastructure collapse — power grid failing, roads deteriorating, oil production collapsed from 3.2M to <800K bpd. CPI 13 = among most corrupt globally. Investment near zero. Institutional collapse. Economic crisis ongoing since 2014."
Vietnam,57,62,45,62,58,WEF GCI 2019 (3.8/7 infra); TI CPI 2024 (37/100); World Bank data,Doi Moi reforms: GDP growth 6.37% over 40 years. Manufacturing hub emergence. Long Thanh Airport under construction. North-South expressway progressing. CPI 37 = high corruption but execution overcomes it (China model). Investment ~5% GDP. Strong delivery for income level.
